Name	title	coding
t3_k0dq4l	White House reporters befuddled by brief Trump statement on stock market: 'Weird as s--t'	
t3_jztvos	Megathread: The GSA Has Informed President-Elect Joe Biden that the Administration is Ready to Begin the Formal Transition Process	
t3_k0359b	It's over for Trump	
t3_k0esea	The Trump administration is considering shortening the recommended quarantine time for Covid-19	
t3_k0coc2	Trump is junking a treaty - and two planes - designed to stop nuclear war	
t3_k07siq	Mark Hamill Reacts to Trump Considering Randy Quaid's Call for Election 'Do-Over'	
t3_k08hyw	Election 2020 live updates: Pennsylvania certifies election results finding Joe Biden the winner	
t3_k00eec	Exiting Trump puts dubious characters in top roles at Pentagon, NSA	
t3_jzwygu	Catholic leaders beg Joe Biden to ‘repent’ his support for LGBT+ rights ‘for his own salvation’ — Anti-LGBT+ Catholic leaders have demanded that president-elect Joe Biden “repent” his support for same-sex marriage and abortion.	
t3_k024k0	Biden says the Trump White House won't give him COVID stockpile information. Here it is.	
t3_k08z5i	President-Elect Joe Biden Clinches Presidency—Again—as Pennsylvania Certifies Election Results	
t3_k09n7r	Nevada Supreme Court certifies Joe Biden's win in Nevada, making his win in the battleground state official	
t3_k09ifr	U.S. To Execute Only Woman On Federal Death Row 8 Days Before Biden Inauguration	
t3_k0ape6	Newsmax CEO Thinks Trump Should Concede When States Certify Elections, Would Support Overturning Electoral College	
t3_k09adn	Pennsylvania finalizes U.S. election results for Biden: governor	
t3_k0effc	'America is back' , says Biden as he unveils team	
t3_k0k3zh	Transition Gets Underway in Earnest as Biden Team Fans Out Across Capital	
t3_k0cdoc	Trump ignores reporter’s question about trying to pardon himself after doing so for turkey	
t3_k0hmtl	Trump campaign says Pennsylvania, Arizona, Michigan to hold public hearings on 2020 election	
t3_k03wpb	Biden Taps Veteran US Diplomat Linda Thomas-Greenfield as UN Ambassador	
t3_k0iaxx	Biden keeps the peace with first Cabinet picks | The former veep hasn’t sparked any bitter fights with the left. But he hasn’t given progressives any major wins either.	
t3_k04a0b	Rush Limbaugh Criticizes Trump Campaign for Hyping Up 'Blockbuster' Voter Fraud Evidence: 'Nothing Happened… Not Good'	
t3_k0eoay	'America is back': Biden pushes past Trump era with nominees	
t3_k0j6dp	Biden becomes first presidential candidate to win more than 80 million votes	
t3_k03gjd	Biden unveils his administration as Trump's firewall crumbles	
t3_k0jlwv	Biden eyes New Mexico governor, Obama surgeon general for health secretary	
t3_k034z9	The Trump administration may privatize Fannie Mae and Freddie Mac — and it could disrupt the nation’s housing-finance system	
t3_jzu5pb	The Authors of the Dictator’s Handbook on What Trump Is Doing Wrong	
t3_jztm0i	Trump Campaign’s Actual Argument in Appeals Court: We’re Only Trying to Disenfranchise 1.5 Million Voters, Not 6 Million Pennsylvanians	
t3_k0dlh2	Trump's DOJ Backs Down on Deporting Women Alleging ICE Gynecological Abuse	
t3_jzt4no	Rep. Michael Waltz: Biden Cabinet picks represent 'headlong push' back to Obama-era foreign policy	
t3_jzx3px	Trump probably won’t be the last politician to reject an election outcome without evidence	
t3_k0d5dm	How Biden can fight climate change without Congress	
t3_k0bpfr	Two more parting shots from Trump aimed squarely at disabled workers	
t3_k0i4cj	Biden says outreach from Trump admin has been 'sincere' as transition begins	
t3_k0c42y	Biden win over Trump in Nevada made official by court	
t3_k0f57y	Shirkey: Lawmakers told Trump they have no role in election	
t3_k07ybo	Joe Biden set to introduce national security team today as Obama-alumni heavy administration takes shape	
t3_k0ixbp	Republicans Won't Have Trump, But Trumpism Is All They Have	
t3_jzzs16	GM abandons Trump’s war against California’s pollution powers	
t3_k00f2c	No mea culpa for all the bad blood, but Trump has bowed to public pressure	
t3_k081lm	Pennsylvania certifies election results for Biden	
t3_jzyror	Federal judge calls Trump suit argued by Rudy Giuliani "Frankenstein's Monster" and dismisses case	
t3_k0azls	Trump’s Enablers Are Sabotaging the Georgia Senate Runoff Election–and Helping Democrats. There’s a weird, right-wing push to boycott January’s pivotal U.S. Senate runoffs. Is Trump angry enough to join it?	
t3_jzsrxm	General Motors abandons Trump in lawsuit fighting California on its own climate rules and vows to work on crisis with Biden	
t3_jzy84b	Midtown Trump Tower To Have Reduced Security After President Leaves Office in January	
t3_jzv4kr	GM withdraws support for Trump lawsuit seeking to roll back auto emissions rules	
t3_k0kg0v	The Inside Story of Michigan’s Fake Voter Fraud Scandal | How a state that was never in doubt became a ‘national embarrassment’ and a symbol of the Republican Party’s fealty to Donald Trump.	
t3_k08nzg	Student Loan Advocates Release Roadmap for the Biden Administration to Fix Broken Programs for Servicemembers, Teachers, Defrauded Students, &amp; Other Vulnerable Borrowers Denied Promised Relief	
t3_k08659	Pennsylvania certifies Biden victory	
t3_k09pft	Pennsylvania Supreme Court rejects Trump campaign's effort to block counting certain absentee ballots	
t3_jzvqda	Trump Lawyer Appears on Fox Touting ‘Promising’ Case in Pennsylvania After It’s Thrown Out by Judge	
t3_k0d7kj	Trump administration wants to cut food stamps to thousands of seniors, lawmakers say	
t3_k0f7cb	Defenders of US Public Schools Call on Biden to Ditch Trump's Disastrous Education Policies—and Obama's Too	
t3_jzt9rt	Fearing turmoil, Wall Street ups pressure on Trump to quit	
t3_k0dwtt	75% of every donation to Trump's leadership PAC could actually be spent by the president himself on things like paying family members or financing a 2024 bid	
t3_k04l3e	The secretive consulting firm that’s become Biden’s Cabinet in waiting	
